{"schema":"airvix.flight.summary/1","derive_rev":1,"sources":["tlog"],"stats":{"duration_s":480,"air_time_s":414,"max_rel_alt_m":86,"max_airspeed_mps":20.2,"max_groundspeed_mps":27.4,"distance_m":6400,"batt_min_v":24.1,"gps_min_sats":5,"gps_max_hdop":3.1},"modes":[{"mode":"FBWA","from_rel_s":0,"to_rel_s":210,"dur_s":210},{"mode":"RTL","from_rel_s":210,"to_rel_s":480,"dur_s":270}],"takeoff":{"lat":31.824,"lon":34.777,"t_rel_s":36},"landing":{"lat":31.83,"lon":34.786,"t_rel_s":450},"facts":[{"id":"F1","key":"max_rel_alt_m","value":86,"unit":"m","t_rel_s":240,"src":"tlog.GLOBAL_POSITION_INT"}],"insights":[{"id":"I1","rule":"failsafe_mode","sev":"error","text_he":"אובדן רדיו הוביל למעבר ל־RTL תוך שניות.","from_rel_s":208,"to_rel_s":212,"evidence":["E0005","E0006"]},{"id":"I2","rule":"gps_glitch","sev":"warning","text_he":"חשד לגליץ GPS: קפיצת מהירות קרקע בלי שינוי במהירות אוויר.","from_rel_s":200,"to_rel_s":206,"evidence":["E0004"]}],"coverage":{"VFR_HUD":0.97,"GLOBAL_POSITION_INT":0.95,"GPS_RAW_INT":0.9,"SYSTEM_TIME":1}}