{"schema":"airvix.flight.summary/1","derive_rev":1,"sources":["tlog"],"stats":{"duration_s":180,"air_time_s":0,"max_rel_alt_m":1.6,"max_airspeed_mps":4.2,"max_groundspeed_mps":0.8,"distance_m":6},"modes":[{"mode":"MANUAL","from_rel_s":0,"to_rel_s":180,"dur_s":180}],"takeoff":null,"landing":null,"facts":[{"id":"F1","key":"max_rel_alt_m","value":1.6,"unit":"m","t_rel_s":90,"src":"tlog.GLOBAL_POSITION_INT"}],"insights":[{"id":"I1","rule":"bench","sev":"info","text_he":"סשן קרקע: לא זוהתה המראה.","from_rel_s":0,"to_rel_s":180,"evidence":["E0001"]}],"coverage":{"VFR_HUD":1,"GLOBAL_POSITION_INT":1,"GPS_RAW_INT":1,"SYSTEM_TIME":0}}