{"schema":"airvix.flight.summary/1","derive_rev":1,"sources":["tlog"],"stats":{"duration_s":600,"air_time_s":530,"max_rel_alt_m":70,"max_airspeed_mps":18.4,"max_groundspeed_mps":19.1,"distance_m":9200},"modes":[{"mode":"FBWA","from_rel_s":0,"to_rel_s":120,"dur_s":120},{"mode":"AUTO","from_rel_s":120,"to_rel_s":600,"dur_s":480}],"takeoff":{"lat":31.824,"lon":34.778,"t_rel_s":30},"landing":{"lat":31.832,"lon":34.792,"t_rel_s":560},"facts":[{"id":"F1","key":"max_rel_alt_m","value":70,"unit":"m","t_rel_s":300,"src":"tlog.GLOBAL_POSITION_INT"}],"insights":[{"id":"I1","rule":"journal_missing","sev":"warning","text_he":"יומן המערכת חסר: אין הרשאת journal. התמונה חלקית.","from_rel_s":0,"to_rel_s":600,"evidence":["E0004"]}],"coverage":{"VFR_HUD":0.96,"GLOBAL_POSITION_INT":0.96,"GPS_RAW_INT":0.94,"SYSTEM_TIME":0.5}}