{"schema":"airvix.flight.summary/1","derive_rev":1,"sources":["tlog"],"stats":{"duration_s":1140,"air_time_s":1058,"max_rel_alt_m":121.6,"max_airspeed_mps":22.4,"max_groundspeed_mps":24.1,"distance_m":18420,"max_dist_home_m":2310,"batt_min_v":23.8,"batt_used_mah":3120,"gps_min_sats":7,"gps_max_hdop":2.4,"hb_max_gap_s":0.9},"modes":[{"mode":"FBWA","from_rel_s":0,"to_rel_s":180,"dur_s":180},{"mode":"AUTO","from_rel_s":180,"to_rel_s":900,"dur_s":720},{"mode":"RTL","from_rel_s":900,"to_rel_s":1140,"dur_s":240}],"takeoff":{"lat":31.824,"lon":34.777,"t_rel_s":42},"landing":{"lat":31.838,"lon":34.804,"t_rel_s":1100},"facts":[{"id":"F1","key":"max_rel_alt_m","value":121.6,"unit":"m","t_rel_s":570,"src":"tlog.GLOBAL_POSITION_INT"},{"id":"F2","key":"distance_m","value":18420,"unit":"m","t_rel_s":1100,"src":"tlog"}],"insights":[{"id":"I1","rule":"gps_low_sats","sev":"warning","text_he":"לווייני GPS ירדו ל־7 לזמן קצר באמצע הטיסה.","from_rel_s":700,"to_rel_s":730,"evidence":["E0006","F1"]},{"id":"I2","rule":"battery_sag","sev":"warning","text_he":"המתח ירד במהלך הטיסה אך נשאר מעל סף האזהרה הקשה.","from_rel_s":800,"to_rel_s":900,"evidence":["E0007"]}],"coverage":{"VFR_HUD":0.99,"GLOBAL_POSITION_INT":0.99,"GPS_RAW_INT":0.98,"SYSTEM_TIME":1}}